site_url,author,headline,language,country,type
nytimes.com,daniel victor,10-Second Videos From Your Sunglasses. Thank Snapchat.,english,United States,legitimate
nytimes.com,jonathan soble,Japan’s Nuclear Industry Finds a Lifeline in India After Foundering Elsewhere,english,United States,legitimate
nytimes.com,jackie calmes,What Is Lost by Burying the Trans-Pacific Partnership?,english,United States,legitimate
nytimes.com,david leonhardt,Clinton’s Substantial Popular-Vote Win,english,United States,legitimate
nytimes.com,mike mcphate,California Today: Why Californians Kept the Death Penalty,english,United States,legitimate
nytimes.com,vanessa friedman,"When Melania Trump Met Michelle Obama, Their Clothes Did Some of the Talking",english,United States,legitimate
nytimes.com,gail collins,The Glass Ceiling Holds,english,United States,legitimate
nytimes.com,elizabeth paton,Stella McCartney Presents Her Men’s Wear Line,english,United States,legitimate
nytimes.com,mohammed hanif,"After Trump, Fear and Gloating in Pakistan",english,United States,legitimate
nytimes.com,andy newman,World (or at Least Brooklyn) Stops for Lost Dog,english,United States,legitimate
nytimes.com,the editorial,The Risks of France’s Big New Database,english,United States,legitimate
nytimes.com,emma g.,Advocates for New York’s Working Poor Push for Discounted Transit Fares,english,United States,legitimate
nytimes.com,amie tsang,Morning Agenda: A Fresh Wave of Deals Ahead,english,United States,legitimate
nytimes.com,sean alfano,"Donald Trump, Leonard Cohen, ‘Arrival’: Your Friday Briefing",english,United States,legitimate
nytimes.com,chris buckley,"With a Cuckoo’s Journey From China, a Mystery Is Solved, and Cheers Go Up",english,United States,legitimate
nytimes.com,reed abelson,Donald Trump Says He May Keep Parts of Obama Health Care Act,english,United States,legitimate
nytimes.com,fernanda santos,His Job? To Power Up the Grand Canyon,english,United States,legitimate
nytimes.com,isabel kershner,Jerusalem’s Latest Argument Over History Is About Fried Innards,english,United States,legitimate
nytimes.com,carl hulse,Hard Choice for Mitch McConnell: End the Filibuster or Preserve Tradition,english,United States,legitimate
nytimes.com,ginia bellafante,"On Staten Island, Pantsuit Nation Met Its Match",english,United States,legitimate
nytimes.com,"carl hulse,",Trump Floats an Olive Branch: Might Keep Parts of the Health Law,english,United States,legitimate
nytimes.com,paul krugman,Thoughts for the Horrified,english,United States,legitimate
nytimes.com,the editorial,The Wrong People to Drain the Swamp,english,United States,legitimate
nytimes.com,david brooks,The View From Trump Tower,english,United States,legitimate
nytimes.com,jan c.,America Needs a War on Terror Veterans Memorial,english,United States,legitimate
nytimes.com,timothy egan,Resist Much,english,United States,legitimate
nytimes.com,the editorial,Voters Drive Sheriff Arpaio Out of Town,english,United States,legitimate
nytimes.com,steven rattner,Trump’s Economic Prescription. First: Do Harm.,english,United States,legitimate
nytimes.com,eric lipton,"Trump Campaigned Against Lobbyists, but Now They’re on His Transition Team",english,United States,legitimate
nytimes.com,didi kirsten,"For Chinese Women, a Surname Is Her Name",english,United States,legitimate
nytimes.com,christopher mele,2nd Night of Trump Protests Brings 29 Arrests in Oregon,english,United States,legitimate
nytimes.com,patrick boehler,"Donald Trump, Leonard Cohen, Afghanistan: Your Friday Briefing",english,United States,legitimate
nytimes.com,benjamin weiser,Man Pleads Guilty to Using Bribes to Obtain Handgun Licenses,english,United States,legitimate
nytimes.com,the associated,Trump Lawyers Agree to Settlement Talks in University Suit,english,United States,legitimate
nytimes.com,kim barker,New Charges for 2 Flophouse Operators Accused in Medicaid Fraud Scheme,english,United States,legitimate
nytimes.com,the associated,"Donald Trump Takes Arizona, Extending G.O.P. Winning Streak in State",english,United States,legitimate
nytimes.com,david w.,"Trump Tower, a Site That Drew Tourists, Now Draws Heavy Security",english,United States,legitimate
nytimes.com,niraj chokshi,"Judge Orders That Bottled Water Be Delivered to Residents of Flint, Mich.",english,United States,legitimate
nytimes.com,william neuman,"In Democratic Stronghold of New York City, Trump Finds Support Among Orthodox Jews",english,United States,legitimate
nytimes.com,reuters ,"Egyptian Rights Group Is Told Its Bank Account Is Blocked, Lawyer Says",english,United States,legitimate
nytimes.com,sheryl gay,The Women Who Helped Donald Trump to Victory,english,United States,legitimate
nytimes.com,mark mazzetti,‘Never Trump’ Becomes ‘Maybe Trump’ in Foreign Policy Sphere,english,United States,legitimate
nytimes.com,katharine q.,Female Clinton Supporters Are Left Feeling Gutted,english,United States,legitimate
nytimes.com,jim dwyer,Janet Reno Was Unafraid of Science That Could Exonerate the Innocent,english,United States,legitimate
nytimes.com,reuters ,"Disney Promises Growth, and Shares Rise in After-Hours Trading",english,United States,legitimate
nytimes.com,richard fausset,Roy Cooper Holds Thin Lead Over Gov. Pat McCrory in North Carolina,english,United States,legitimate
nytimes.com,ellen schwartzberg,A Silent Agreement on York Avenue,english,United States,legitimate
nytimes.com,eli rosenberg,Manhattan Subway Passage Becomes Emotional Outlet After Election,english,United States,legitimate
nytimes.com,michael d.,"Trump Wants to ‘Drain the Swamp,’ but Change Will Be Complex and Costly",english,United States,legitimate
nytimes.com,john herrman,"Online, Everything Is Alternative Media",english,United States,legitimate
nytimes.com,andrew e.,"Tajik Police Commander, Trained in U.S., Appears to Rise in Islamic State Ranks",english,United States,legitimate
nytimes.com,the associated,Report: U.S. Close to Accepting Hundreds of Australia's Refugees,english,United States,legitimate
nytimes.com,phoebe lett,White Women Voted Trump. Now What?,english,United States,legitimate
nytimes.com,rick gladstone,U.N. Warns of Starvation Peril in Rebel Side of Aleppo,english,United States,legitimate
nytimes.com,reuters ,"Despite Vaccination Efforts Measles Kills 350 Children a Day, Report Says",english,United States,legitimate
nytimes.com,charles v.,Cuomo Strikes Deal to Revive Affordable Housing Program,english,United States,legitimate
nytimes.com,jessica bennett,"Girls Can Be Anything, Just Not President",english,United States,legitimate
nytimes.com,ryan burleson,Honky-Tonk Brunch Spot for Brooklyn’s Hellbound,english,United States,legitimate
nytimes.com,karen workman,"Donald Trump, Marijuana, Rolling Stones: Your Thursday Evening Briefing",english,United States,legitimate
nytimes.com,alyson krueger,Spinning Goes to the Movies at ImaxShift,english,United States,legitimate
nytimes.com,sabrina tavernise,A Lesson for India in a Fog So Thick It Could Kill a Cow,english,United States,legitimate
nytimes.com,john r.,A Vehicle’s Sound System Can Be a Matter of Life and Death,english,United States,legitimate
nytimes.com,erin geiger,Cooper Hewitt Museum: A Mommy-and-Me Hot Spot,english,United States,legitimate
nytimes.com,ian austen,"Canada’s Big Dams Produce Clean Energy, and High Levels of Mercury",english,United States,legitimate
nytimes.com,robert p.,"The Rage of White, Christian America",english,United States,legitimate
nytimes.com,charles mcdermid,"Donald Trump, Shinzo Abe, Interpol: Your Friday Briefing",english,United States,legitimate
nytimes.com,tom voelk,"Video Review: Buick Envision, a Crossover With a Chinese Heritage",english,United States,legitimate
nytimes.com,phil galewitz,A Study Tests the Safety of Women Using Abortion Pills Sent by Mail,english,United States,legitimate
nytimes.com,keith bradsher,"In China-U.S. Trade War, Trump Would Have Weapons",english,United States,legitimate
nytimes.com,najim rahim,Taliban Strike German Consulate in Afghan City of Mazar-i-Sharif,english,United States,legitimate
nytimes.com,philip galanes,Mending Fences (Even When You Really Don’t Want To),english,United States,legitimate
nytimes.com,jennifer steinhauer,Chuck Schumer Prepares for His Next Challenge: Leading Senate Democrats,english,United States,legitimate
nytimes.com,christine hauser,"Aaron Schock, Ex-Illinois Congressman, Is Indicted",english,United States,legitimate
nytimes.com,jennifer saba,Yahoo’s Breach Gives Verizon Leverage in Deal Talks,english,United States,legitimate
nytimes.com,michael forsythe,Interpol Names Chinese Police Official as Its New President,english,United States,legitimate
nytimes.com,elizabeth olson,Law Firm Arnold & Porter to Merge With Rival Kaye Scholer,english,United States,legitimate
nytimes.com,james gorman,"Oh, for the Joy of a Tickled Rat",english,United States,legitimate
